nom;reference;category_id;prix;unite;description
Chlore granulé 5kg;CHLORE-001;;25.50;kg;Chlore rapide pour traitement piscine
Filtre à sable;FILTRE-001;;450.00;unité;Filtre à sable Hayward 14m³/h
pH Moins liquide 1L;PH-001;;12.90;L;Correcteur pH pour piscine
Balai aspirateur;BALAI-001;;35.00;unité;Balai aspirateur manuel avec brosse
Anti-algues concentré;ALGUE-001;;18.50;L;Traitement préventif anti-algues
Pompe de filtration;POMPE-001;;380.00;unité;Pompe auto-amorçante 1CV
Skimmer standard;SKIM-001;;45.00;unité;Skimmer pour piscine enterrée
Tuyau PVC 50mm;TUYAU-001;;8.50;mètre;Tuyau PVC pression PN16
